oid,matched_via,report_title,db_author,report_author
6829,174 N.W.2d 717,State v. Hapip,Erickstad,"Paulson, Wm."
7072,198 N.W.2d 218,State v. Champagne,Teigen,"Erickstad, Ralph"
8005,278 N.W.2d 358,State v. Gustafson,Pederson,"VandeWalle, Gerald"
8486,310 N.W.2d 709,State v. Kaufman,Erickstad,"Paulson, Wm."
9715,392 N.W.2d 389,State v. Ohnstad,Erickstad,Per Curiam
9594,383 N.W.2d 813,State v. Kautzman,VandeWalle,Per Curiam
9767,396 N.W.2d 729,State v. Kesler,(none),"VandeWalle, Gerald"
6517,142 N.W.2d 140,Hook v. Crary,Burke,Per Curiam
6535,143 N.W.2d 718,Thomas v. City of Devils Lake,Teigen,"Giese, Emil"
6509,141 N.W.2d 790,Writh v. Workmen's Comp. Bureau,Murray,Per Curiam
6720,160 N.W.2d 406,Johnson v. Richland Co.,Paulson,Per Curiam
6557,145 N.W.2d 899,Fraase v. Murray,Teigen,Per Curiam
6780,167 N.W.2d 754,"Tri-State Insurance Company v. Lubbock Machine & Supply Co., et al.",Erickstad,"Strutz, Alvin"
6806,171 N.W.2d 133,Odegaard v. Craig,Teigen,"Coyne, Eugene"
6838,175 N.W.2d 658,Tri-State Ins. Co. v. Lubbock Machine & Supply Co.,Erickstad,"Strutz, Alvin"
6902,181 N.W.2d 730,"Berg, et al. v. Kremers",Teigen,"Englert, Hamilton"
6869,179 N.W.2d 335,"O'Brien, et al. v. Farmers Union Oil Company of Rolla",Erickstad,"Strutz, Alvin"
7072,198 N.W.2d 218,"Municipal Airport Authority of the City of Fargo v. Halland, et al.",Teigen,"Knudson, Harvey"
7064,198 N.W.2d 107,First American Bank and Trust Co. v. Ellwein,Knudson,"Teigen, Obert"
7137,202 N.W.2d 844,"Abbey v. State, et al.",Erickstad,"Paulson, Wm."
7235,214 N.W.2d 109,Estate of Johnson,Beede,"Vogel, Robert"
7172,209 N.W.2d 758,Brink v. Curless,Teigen,"Kelsch, Clemens"
7447,232 N.W.2d 823,Walker v. Link,Vogel,Per Curiam
7818,263 N.W.2d 114,Interest of D.S.,Erickstad,"Paulson, Wm."
8020,279 N.W.2d 415,Saefke v. VandeWalle,(none),Per Curiam
8266,298 N.W.2d 372,Disciplinary Action Against McMahon,Pederson,Per Curiam
8486,310 N.W.2d 709,Disciplinary Action Against Ulland,Erickstad,Per Curiam
8511,311 N.W.2d 191,"Eagan v. D.M.G., et al.",VandeWalle,"Erickstad, Ralph"
8795,329 N.W.2d 123,Discipline of Hatlie,Erickstad,Per Curiam
8981,338 N.W.2d 836,"Ouren v. Krebsbach, et al.",(none),Per Curiam
9039,342 N.W.2d 393,Admission to the Bar of Thompson,Pederson,"Erickstad, Ralph"
9059,344 N.W.2d 489,"Anderson v. State, d.b.a. The Bank of North Dakota",Erickstad,Per Curiam
9169,352 N.W.2d 628,Eisenzimmer v. City of Balfour,Erickstad,"VandeWalle, Gerald"
9169,352 N.W.2d 628,Disciplinary Action Against Dronen,Erickstad,Per Curiam
9208,355 N.W.2d 798,"Allegree, et al. v. Jankowski, et al.",Gierke,"Erickstad, Ralph"
9080,346 N.W.2d 285,Disciplinary Action Against Larson,(none),Per Curiam
9350,365 N.W.2d 847,Matter of Bo,Gierke,"Meschke, Herbert"
9409,370 N.W.2d 513,Disciplinary Action Against Kraemer (CONSOLIDATED W/19870061),Erickstad,Per Curiam
9351,366 N.W.2d 444,"Federal Land Bank of Saint Paul v. Wallace, et al.",Erickstad,"VandeWalle, Gerald"
9370,367 N.W.2d 148,First National Bank of Belfield v. Burich,Erickstad,"Levine, Beryl"
9452,373 N.W.2d 392,"Meyer v. Hansen, et al.",Erickstad,"Levine, Beryl"
9270,358 N.W.2d 791,Disciplinary Action Against Myhre,Erickstad,Per Curiam
9409,370 N.W.2d 513,"Benefiet v. Hoiby, et al.",Erickstad,"VandeWalle, Gerald"
9452,373 N.W.2d 392,Disciplinary Action Against Ostfield,Erickstad,Per Curiam
9472,374 N.W.2d 607,Disciplinary Action Against Montgomery,Erickstad,Per Curiam
9420,370 N.W.2d 567,Disciplinary Action Against Moug,Erickstad,Per Curiam
9467,374 N.W.2d 347,Disciplinary Action Against Cieminski,Erickstad,Per Curiam
9565,380 N.W.2d 654,Prock v. Prock,(none),Per Curiam
9519,378 N.W.2d 678,Disciplinary Action Against White,Erickstad,Per Curiam
9519,378 N.W.2d 678,Disability of Williams,Erickstad,Per Curiam
20440,393 N.W.2d 537,Bishop v. Gajeski,(none),Per Curiam
9753,395 N.W.2d 148,Gillan v. Saffell,VandeWalle,"Levine, Beryl"
9732,392 N.W.2d 828,Disciplinary Action Against Bailey,Erickstad,Per Curiam
9767,396 N.W.2d 729,Matter of Schirado,(none),Per Curiam
9910,408 N.W.2d 737,Powell v. Hjelle,Erickstad,"Levine, Beryl"
9889,406 N.W.2d 364,Disciplinary Board v. Britton,Erickstad,Per Curiam
20425,414 N.W.2d 606,Dizayee v. Dizayee,Appeals,Per Curiam
20444,417 N.W.2d 855,Garrett v. Nagel,Appeals,Per Curiam
20443,417 N.W.2d 184,"Jepson v. ND Workmen's Compensation Bureau, et al.",Appeals,Per Curiam
10005,417 N.W.2d 183,Disciplinary Board v. Williams,Erickstad,Per Curiam
10097,421 N.W.2d 466,City of Bismarck v. Hoopman,Levine,"Erickstad, Ralph"
10027,417 N.W.2d 853,Disciplinary Board v. Overboe,Erickstad,Per Curiam
10043,418 N.W.2d 789,"Disciplinary Board v. Teevens, Montgomery and Johnson",Erickstad,Per Curiam
10028,417 N.W.2d 854,Disability Inactive Status of Haugen        (CON w/ 900298),(none),Per Curiam
20451,429 N.W.2d 456,Dakota Bank and Trust Co. of Fargo v. Fenske Feed,Appeals,Per Curiam
20467,433 N.W.2d 549,State v. Dressler,(none),Per Curiam
20468,433 N.W.2d 552,State v. Bauder,(none),Per Curiam
10539,450 N.W.2d 710,State v. Wahl,Erickstad,"VandeWalle, Gerald"
10452,445 N.W.2d 660,Disciplinary Board v. Williams,Erickstad,Per Curiam
10555,450 N.W.2d 771,Disciplinary Board v. Whitesides Larson,Erickstad,Per Curiam
10538,450 N.W.2d 707,"Odden v. O'Keefe, et al.",(none),Per Curiam
20463,460 N.W.2d 717,Huber v. Jahner,(none),Per Curiam
20462,460 N.W.2d 411,Moe v. Moe,(none),Per Curiam
10656,456 N.W.2d 772,Disciplinary Board v. Palda,Erickstad,Per Curiam
10655,456 N.W.2d 771,Disciplinary Board v. Britton,Erickstad,Per Curiam
10799,466 N.W.2d 101,State v. Wilson,Erickstad,"Meschke, Herbert"
10656,456 N.W.2d 772,Disciplinary Board v. Britton,Erickstad,Per Curiam
10797,465 N.W.2d 480,City of Bismarck v. Berger,(none),"Medd, Joel"
11165,487 N.W.2d 599,Disciplinary Board v. Jones,Erickstad,"Johnson, J."
10792,465 N.W.2d 155,Disciplinary Board v. Galloway,Erickstad,Per Curiam
10796,465 N.W.2d 175,Reimers Seed Co. v. Stedman et al.,(none),"Heen, Douglas"
10873,469 N.W.2d 801,Ebach v. Ralston et al,Gierke,"Levine, Beryl"
11118,484 N.W.2d 102,Disciplinary Board v. Kaiser,(none),Per Curiam
10799,466 N.W.2d 101,Disciplinary Board v. Britton,Erickstad,Per Curiam
11098,482 N.W.2d 842,Green v. Gustafson,Erickstad,"Levine, Beryl"
10931,472 N.W.2d 914,Disciplinary Board v. Johnson,Erickstad,Per Curiam
10924,472 N.W.2d 472,Disciplinary Board v. Bailey,Erickstad,Per Curiam
10934,473 N.W.2d 134,Petition to Relocate Judicial Chambers - South Central Judicial District,Erickstad,Per Curiam
10934,473 N.W.2d 134,Northwest Judicial District Vacancy,Erickstad,Per Curiam
18342,617 N.W.2d 131,State v. Lopez,(none),"Levine, Beryl"
11143,485 N.W.2d 345,Disciplinary Board v. Whitesides Larson,Erickstad,Per Curiam
11116,483 N.W.2d 780,Faulconbridge v. State Bar Board,Erickstad,Per Curiam
11098,482 N.W.2d 842,Judicial Conduct Commission v. Kerian,Erickstad,Per Curiam
11144,485 N.W.2d 774,Disciplinary Board v. Britton,Erickstad,Per Curiam
11120,484 N.W.2d 110,Disciplinary Board v. Britton,Erickstad,Per Curiam
11760,522 N.W.2d 745,District Judge Vacancy in the Southeast Judicial District,Erickstad,Per Curiam
11007,477 N.W.2d 818,Disciplinary Board v. Jenson,Erickstad,Per Curiam
20453,489 N.W.2d 594,"Brakke v. Kensrud, et al.    (cross ref. w/900440 & 930288)",(none),Per Curiam
20454,489 N.W.2d 887,State v. Deery,(none),Per Curiam
20446,488 N.W.2d 411,"Schmidt v. Ramsey County, et al.",(none),Per Curiam
11076,481 N.W.2d 225,Disciplinary Board v. Johnson,Erickstad,Per Curiam
11140,484 N.W.2d 860,Disciplinary Board v. Heustis,Erickstad,Per Curiam
11204,489 N.W.2d 886,Putney v. Backes,VandeWalle,"Meschke, Herbert"
11090,482 N.W.2d 285,Disciplinary Board v. Anderson (Cross w/ 920226),Erickstad,Per Curiam
20459,493 N.W.2d 219,State v. Keegan,(none),Per Curiam
20460,493 N.W.2d 704,Zacher v. Zacher,(none),Per Curiam
20458,493 N.W.2d 216,Sauer v. Hayes-Sauer,(none),Per Curiam
20464,494 N.W.2d 174,City of Fargo v. Maashio,(none),Per Curiam
20423,503 N.W.2d 849,Interest of P.C.          (CONFIDENTIAL),(none),Per Curiam
11442,502 N.W.2d 252,Disciplinary Board v. Lochow,Erickstad,Per Curiam
20430,497 N.W.2d 101,Schultz v. ND Workers' Compensation Bureau,(none),Per Curiam
11239,491 N.W.2d 703,Disciplinary Board v. Anderson (Con.w/See Docket Memo/Cross-ref. 920078),Erickstad,Per Curiam
20431,497 N.W.2d 431,Culver v. Culver,(none),Per Curiam
20432,497 N.W.2d 434,City of Mandan v. Hoesel,(none),Per Curiam
11466,504 N.W.2d 311,Disciplinary Board v. Nassif,(none),Per Curiam
11325,496 N.W.2d 552,Disciplinary Board v. Baird,Levine,Per Curiam
11750,522 N.W.2d 425,"District Judge Vacancy, Bottineau, NE Judicial District",VandeWalle,Per Curiam
11332,496 N.W.2d 580,Disciplinary Board v. Rau,(none),Per Curiam
11604,512 N.W.2d 723,Weber v. Weber,Levine,"Neumann, William"
11430,501 N.W.2d 733,Disciplinary Board v. Linnerooth,Levine,Per Curiam
11444,502 N.W.2d 504,Disciplinary Board v. Keller,VandeWalle,Per Curiam
11493,506 N.W.2d 714,Disciplinary Board v. Robb,VandeWalle,Per Curiam
11587,512 N.W.2d 454,Disciplinary Board v. Larson (Consol. w/ 930220),VandeWalle,Per Curiam
11479,505 N.W.2d 749,Disciplinary Board v. Schmidt (Consolidated w 930222),Levine,Per Curiam
11504,507 N.W.2d 541,Fode v. Director of the Department of Transportation,Meschke,"VandeWalle, Gerald"
11644,516 N.W.2d 278,"State of ND, Workers Comp. Bureau v. Kostka Food Service",(none),"Meschke, Herbert"
11660,517 N.W.2d 631,Estate of Voeller  (cross/ref. 950035),Levine,Per Curiam
11604,512 N.W.2d 723,District Judge Vacancy - Grafton,Levine,Per Curiam
11750,522 N.W.2d 425,District Judge Vacancy - South Central Judicial District,VandeWalle,Per Curiam
11762,522 N.W.2d 747,Judge Vacancy in the Lisbon Chambers - SE Judicial District,VandeWalle,Per Curiam
11761,522 N.W.2d 746,East Central Judicial Vacancy - Hillsboro,Levine,Per Curiam
11740,521 N.W.2d 643,"Hosman, et al. v. ND State University, et al.",Levine,Per Curiam
11803,525 N.W.2d 250,Morehouse v. Morehouse,Levine,Per Curiam
11760,522 N.W.2d 745,Rugby Judicial Vacancy,Erickstad,Per Curiam
11762,522 N.W.2d 747,"Judicial Vacancy - Wasburn, ND, South Central District",VandeWalle,Per Curiam
11805,525 N.W.2d 251,"Smith v. City of Grand Forks, et al.",Olson,Per Curiam
11644,516 N.W.2d 278,Disciplinary Board v. Kinsey,(none),Per Curiam
11805,525 N.W.2d 251,Dakutak v. Dakutak,Olson,Per Curiam
11817,526 N.W.2d 107,"Ziebarth, et al. v. State, et al.",Levine,Per Curiam
11803,525 N.W.2d 250,"Kieffer, et al. v. Huebner, et al.",Levine,Per Curiam
11690,519 N.W.2d 286,Disciplinary Board v. Bard,Meschke,Per Curiam
11938,533 N.W.2d 691,"Disciplinary Board v. Rau (consolidate w/ 940186, 940187, 940188)",Levine,Per Curiam
11698,519 N.W.2d 311,Disciplinary Board v. Voigt,Levine,Per Curiam
11790,524 N.W.2d 605,"United Accounts, Inc. v. Teladvantage, Inc.  (cross-ref. w/920235 & 920317)",VandeWalle,Per Curiam
11807,525 N.W.2d 252,Lithun v. DuPaul,Levine,Per Curiam
11717,520 N.W.2d 585,Bolinske v. Jaeger,Levine,Per Curiam
11698,519 N.W.2d 311,Disciplinary Board v. Nassif (Cross-reference w/920374),Levine,Per Curiam
11819,526 N.W.2d 113,"Jensen v. Wrolstad, et al.",Levine,Per Curiam
11836,527 N.W.2d 270,Disciplinary Board v. Dosch (Consol. w/ 940311 through 940315),Levine,Per Curiam
11838,527 N.W.2d 274,Disciplinary Board v. Bailey   (Consol. w/940361; 940396-940397),Levine,Per Curiam
11979,536 N.W.2d 661,State v. Clinkscales,(none),"Levine, Beryl"
11870,529 N.W.2d 870,"District Judge Vacancy, Linton, South Central Judicial District",Levine,Per Curiam
11956,534 N.W.2d 816,Judicial Conduct Commission v. Grenz,Levine,Per Curiam
11899,530 N.W.2d 645,Zahn v. Graff,VandeWalle,Per Curiam
12077,541 N.W.2d 684,Disciplinary Board v. Neset,Levine,Per Curiam
11932,533 N.W.2d 145,Disciplinary Board v. Schubert-Madsen Consolw/ 950139 & 950140,Levine,Per Curiam
11997,537 N.W.2d 658,Disciplinary Board v. Qualley,VandeWalle,Per Curiam
12004,538 N.W.2d 778,Disciplinary Board v. Swanson,(none),Per Curiam
12635,575 N.W.2d 634,"District Judge Vacancy, Southeast Judicial District",Levine,Per Curiam
12165,546 N.W.2d 366,City of Bismarck v. Stuart (Ronald)        (See Docket Memo),(none),Per Curiam
12173,547 N.W.2d 541,Disciplinary Board v. Nassif (Cons. w/ 950400 & 950403),VandeWalle,Per Curiam
12204,549 N.W.2d 671,Disciplinary Board v. Orvik,(none),Per Curiam
12187,548 N.W.2d 372,Disciplinary Board v. LaQua,Meschke,Per Curiam
18258,1997 ND 195,Dougan v. Dougan,(none),Per Curiam
18256,1997 ND 186,Kryzsko v. Kryzsko,(none),Per Curiam
18254,1997 ND 184,State v. Leppert                    (CONSOLIDATED w/970041),(none),Per Curiam
18257,1997 ND 189,State v. Rieger  (CONSOLIDATED W/ 970064),(none),Per Curiam
18255,1997 ND 185,Laney v. Uecker,(none),Per Curiam
18253,1997 ND 183,State v. Novak,(none),Per Curiam
18262,1997 ND 211,"Pederson, et al. v. Kolschefsky",(none),Per Curiam
18261,1997 ND 208,Boehm v. Berger,(none),Per Curiam
18260,1997 ND 206,Austin v. State                    (cross-reference w/930261),(none),Per Curiam
18265,1997 ND 218,Gerard v. State  (CONSOL. w/970136; 970137)  (cross-ref. w/960264),(none),Per Curiam
18264,1997 ND 217,City of Fargo v. Rockwell,(none),Per Curiam
18259,1997 ND 198,"Dietrich v. ND Workers Comp. Bureau, et al.",(none),Per Curiam
18263,1997 ND 216,State v. Feigert,(none),Per Curiam
18303,1998 ND 3,Moran v. Sheppard,(none),Per Curiam
18267,1997 ND 220,Vetter v. Vetter,(none),Per Curiam
18269,1997 ND 242,State v. Blackhoop,(none),Per Curiam
18266,1997 ND 219,Pavlicek v. Allison,(none),Per Curiam
18302,1998 ND 28,State v. McMorrow,(none),Per Curiam
18282,1998 ND 1,"Morton v. Fladeland, et al.",(none),Per Curiam
18304,1998 ND 43,State v. Guilbert,(none),Per Curiam
18268,1997 ND 239,Foster v. State (Cross Ref. w/960025),(none),Per Curiam
18294,1998 ND 2,"Rheaume v. Dir., N.D. Dept. of Transportation",(none),Per Curiam
18301,1998 ND 27,Binstock v. Binstock,(none),Per Curiam
12526,1997 ND 196,Disciplinary Board v. Query,(none),Per Curiam
18306,1998 ND 47,Tetzloff v. Tetzloff,(none),Per Curiam
18313,1998 ND 84,State v. Black Cloud,(none),Per Curiam
18311,1998 ND 81,State v. Black Cloud            (cross-reference w/970322),(none),Per Curiam
12713,1998 ND 134,Disciplinary Board v. Dvorak,(none),Per Curiam
12569,1997 ND 234,Disciplinary Board v. Fisher (Consolidated w/ 970344),(none),Per Curiam
18312,1998 ND 82,Holzer v. Jochim (Cross-Reference w/ 950198 & 960061),(none),Per Curiam
18307,1998 ND 63,State v. Jorde,(none),Per Curiam
12782,1998 ND 206,Disciplinary Board v. Neset,(none),Per Curiam
18308,1998 ND 73,State v. Wruck,(none),Per Curiam
18309,1998 ND 79,City of Bismarck v. Fischer,(none),Per Curiam
18284,1998 ND 124,Tibor v. Tibor,(none),Per Curiam
18286,1998 ND 127,State v. Webb,(none),Per Curiam
12599,1998 ND 59,Judicial Vacancy in Northwest Judicial District,(none),Per Curiam
12600,1998 ND 58,Judicial Vacancy in South Central Judicial District,(none),Per Curiam
18310,1998 ND 80,State v. Novak                           (Cross-reference w/970083),(none),Per Curiam
18285,1998 ND 125,Barth v. Barth,(none),Per Curiam
18291,1998 ND 185,State v. Vasquez,(none),Per Curiam
18283,1998 ND 108,Bachmeier v. Bachmeier,(none),Per Curiam
18305,1998 ND 44,Interest of M.B.     (CONFIDENTIAL),(none),Per Curiam
12626,1998 ND 60,Disciplinary Board v. Swanson  (Consolidated w/ 980071),(none),Per Curiam
12675,1998 ND 90,Disciplinary Board v. Lee,(none),Per Curiam
18292,1998 ND 195,State v. Petersen,(none),Per Curiam
18287,1998 ND 162,Towne v. Dinius (Cross-reference w/ 960388),(none),Per Curiam
12657,1998 ND 98,Judicial Vacancy in the South Central Judicial District,(none),Per Curiam
12722,1998 ND 136,Petition for Change of Designation of Judgeship No. 8,(none),Per Curiam
18289,1998 ND 183,"Blackbird v. Olson, Director, Dept. of Human Services",(none),Per Curiam
18297,1998 ND 208,Buffalo v. Buffalo,(none),Per Curiam
18288,1998 ND 182,State v. Klein,(none),Per Curiam
18290,1998 ND 184,"Lee v. ND Workers Comp. Bur., et al.",(none),Per Curiam
18296,1998 ND 207,Gullickson v. Gullickson,(none),Per Curiam
18331,1999 ND 22,State v. Vincent,(none),Per Curiam
18295,1998 ND 205,Anton v. Moore,(none),Per Curiam
18293,1998 ND 196,"McGee, et al. v. Palczewski, d/b/a C.P. Welding",(none),Per Curiam
18335,1999 ND 4,Estate of Hartleib,(none),Per Curiam
18300,1998 ND 211,Reiswig v. Reiswig,(none),Per Curiam
18299,1998 ND 210,Hollis v. Moore,(none),Per Curiam
18323,1999 ND 20,State v. Richards,(none),Per Curiam
18298,1998 ND 209,Rodacker v. ND Workers Comp. Bureau,(none),Per Curiam
18322,1999 ND 19,"Roberson, et al. v. Anderson",(none),Per Curiam
18320,1999 ND 18,Dethloff v. Dethloff (Cross Ref. w/970233),(none),Per Curiam
18328,1999 ND 21,Hovland v. McCabe,(none),Per Curiam
12900,1999 ND 110,Disciplinary Board v. Moe,(none),Per Curiam
18336,1999 ND 40,State v. Palmer,(none),Per Curiam
18337,1999 ND 41,State v. Martineau              (CONSOLIDATED W/980364),(none),Per Curiam
18339,1999 ND 83,Krenz v. Krenz,(none),Per Curiam
18338,1999 ND 71,Vass v. Sissell,(none),Per Curiam
18315,1999 ND 101,State v. Stephens,(none),Per Curiam
18340,1999 ND 84,"Kouba v. FEBCO, Inc., et al. (Cross-reference w/950295 & 980094)",(none),Per Curiam
18341,1999 ND 99,City of West Fargo v. Stuart,(none),Per Curiam
18332,1999 ND 227,Renner v. Mikkelson,(none),Per Curiam
18317,1999 ND 123,State v. Miller,(none),Per Curiam
12873,1999 ND 69,"District Judge Vacancy, Southeast Judicial District",(none),Per Curiam
18319,1999 ND 141,"Jones v. Meyer,dba 50's Cafe",(none),Per Curiam
18321,1999 ND 186,Sand v. Sand,(none),Per Curiam
18316,1999 ND 108,Workers Comp. Bureau v. Erhardt,(none),Per Curiam
12919,1999 ND 122,Judicial Conduct Commission v. Hoffman (Consolidated w/990061-990063),(none),Per Curiam
18318,1999 ND 124,"Gajewski v. Dornacker, et al.",(none),Per Curiam
18324,1999 ND 206,Christianson v. Christianson,(none),Per Curiam
18327,1999 ND 209,State v. Tuchscherer,(none),Per Curiam
18330,1999 ND 211,"St. Yves v. DJ's Dance & Arcade, Inc.",(none),Per Curiam
13003,1999 ND 202,Disciplinary Board v. Landon,(none),Per Curiam
13160,1999 ND 82,Disciplinary Board v. Boughey,(none),Per Curiam
18314,1999 ND 100,Interest of D.S.A.  (CONFIDENTIAL - M.H.),(none),Per Curiam
18329,1999 ND 210,City of Valley City v. Stuart,(none),Per Curiam
13021,1999 ND 205,Disciplinary Board v. Boughey (CONSOLIDATED W/ 990184 & 19990304),(none),Per Curiam
12954,1999 ND 161,Disciplinary Board v. Robb,(none),Per Curiam
13037,1999 ND 229,Disciplinary Board v. Seaworth,(none),Per Curiam
18325,1999 ND 207,Syvertson v. Heit,(none),Per Curiam
18334,1999 ND 231,State v. Stibbe,(none),Per Curiam
13049,1999 ND 226,Matter of Abolition of Judgeship Under NDCC 27-05-02.1 (NEJD)(Ref. w/990246-249),VandeWalle,Per Curiam
18333,1999 ND 230,Meyers v. Meyers,(none),Per Curiam
18326,1999 ND 208,Hamilton v. Johnson,(none),Per Curiam
18364,2000 ND 4,Sissell v. Nagel    (CONSOLIDATED W/ 19990270),(none),Per Curiam
18368,2000 ND 66,State v. Dobson,(none),Per Curiam
13190,2000 ND 127,Montgomery v. Disciplinary Board,(none),Per Curiam
18370,2000 ND 69,State v. Johnson,(none),Per Curiam
18373,2000 ND 76,State v. Serr                                (Cross-reference w/970282),(none),Per Curiam
13077,2000 ND 19,"Strom-Sell v. Council for Concerned Citizens, et al.",(none),Per Curiam
18365,2000 ND 40,Spath v. State,(none),Per Curiam
18367,2000 ND 65,State v. Soum,(none),Per Curiam
18363,2000 ND 34,Schlafman v. Schell,(none),Per Curiam
18342,2000 ND 100,"Bublitz, dba DC Marketing v. Tsang, dba Purple Rooster",(none),Per Curiam
18366,2000 ND 5,"Navratil, et al. v. Schlatter, et al.",(none),Per Curiam
13130,2000 ND 48,State v. Farok,(none),Per Curiam
18369,2000 ND 68,State v. Sommer,(none),Per Curiam
13123,2000 ND 87,Disciplinary Board v. McDonald    (CONSOLIDATED W/990360 & 990361),(none),Per Curiam
18344,2000 ND 117,Stibbe v. Saunders     (See Docket Memo),(none),Per Curiam
18372,2000 ND 73,"Friedt, et al. v. Hettinger County, et al.",(none),Per Curiam
13162,2000 ND 98,Disciplinary Board v. Dvorak,(none),Per Curiam
18346,2000 ND 128,State v. Krall,(none),Per Curiam
18371,2000 ND 70,Emter v. Emter,(none),Per Curiam
18351,2000 ND 173,"Harn v. County of McKenzie, et al. (cross-reference w/980260)",(none),Per Curiam
18352,2000 ND 176,City of Fargo v. Doty,(none),Per Curiam
18348,2000 ND 142,Comes v. State,(none),Per Curiam
13176,2000 ND 99,Peterson v. ND Workers Comp. Bureau,(none),Per Curiam
18343,2000 ND 102,"Werlinger, et al. v. Champion Healthcare, et al. (cross w/990027 & 990032)",(none),Per Curiam
18398,2001 ND 26,"Carry Mocassin, et al. v. State Farm",(none),Per Curiam
13187,2000 ND 125,Disciplinary Board v. Roybal,(none),Per Curiam
13189,2000 ND 126,Disciplinary Board v. Stevenson,(none),Per Curiam
13206,2000 ND 146,Disciplinary Action Against Robb,(none),Per Curiam
18357,2000 ND 197,State v. Wilson,(none),Per Curiam
18349,2000 ND 171,"Coleman v. Goulet, f/k/a Chase",(none),Per Curiam
18350,2000 ND 172,City of Fargo v. Hersch,(none),Per Curiam
18358,2000 ND 198,State v. Lunstad,(none),Per Curiam
18359,2000 ND 199,State v. Gehring,(none),Per Curiam
18355,2000 ND 193,"Lake Region Lutheran Home, Inc. v. Halvorson, et al.",(none),Per Curiam
13359,2001 ND 39,Runge v. Runge,(none),Per Curiam
18354,2000 ND 191,"Belisle v. Gibson, et al.",(none),Per Curiam
18395,2001 ND 23,"Weathers, et al. v. Peters, et al.",(none),Per Curiam
13321,2000 ND 211,"Syvertson v. Malaktaris, et al.",(none),Per Curiam
18394,2001 ND 22,Fredericks v. American Federal Bank,(none),Per Curiam
18403,2001 ND 5,State v. Kelly,(none),Per Curiam
18356,2000 ND 195,Schumacher v. Schumacher                              (Cross-ref. w/990016),(none),Per Curiam
18353,2000 ND 180,"Schuh, et al. v. Weiss, et al.",(none),Per Curiam
18361,2000 ND 215,State v. Lee,(none),Per Curiam
18360,2000 ND 213,"Matrix Properties, Corp. v. TAG Investments, et al. (cross-ref. w/990336)",(none),Per Curiam
18347,2000 ND 140,Designation of the Erickstad Courtroom,(none),Per Curiam
18400,2001 ND 3,City of Fargo v. Salsman,(none),Per Curiam
18362,2000 ND 216,Mondry v. Mondry,(none),Per Curiam
13299,2001 ND 7,Disciplinary Board v. Howe,(none),Per Curiam
13277,2000 ND 221,Disciplinary Board v. Keller,(none),Per Curiam
18396,2001 ND 24,Wilson v. State   (cross-reference w/990193),(none),Per Curiam
13342,2001 ND 55,Disciplinary Board v. Hawkins,(none),Per Curiam
18402,2001 ND 49,State v. Knudson,(none),Per Curiam
18393,2001 ND 2,Englund v. State    (Consolidated w/20000251 through 20000254),(none),Per Curiam
18401,2001 ND 42,State v. Keeney,(none),Per Curiam
13252,2000 ND 194,Disciplinary Board v. Robb   (Cross-reference w/ 20000096),(none),Per Curiam
18405,2001 ND 64,State v. Axtman,(none),Per Curiam
18383,2001 ND 129,"Interest of P.M., et al. (CONFIDENTIAL)",(none),Per Curiam
18399,2001 ND 27,Strutz v. State,(none),Per Curiam
18411,2001 ND 89,Kinzley v. Kinzley,(none),Per Curiam
18406,2001 ND 65,State v. Klein,(none),Per Curiam
18377,2001 ND 107,State v. Abnar     (CONSOLIDATED w/20000288),(none),Per Curiam
18407,2001 ND 75,Halvorson v. Halvorson,(none),Per Curiam
18376,2001 ND 106,State v. Aune                                  (cross-ref. w/20020106),(none),Per Curiam
18379,2001 ND 115,Demarce v. State     (CONSOLIDATED W/20000304),(none),Per Curiam
18386,2001 ND 161,State v. Ballard,(none),Per Curiam
18409,2001 ND 77,Yantzer v. Yantzer,(none),Per Curiam
18410,2001 ND 79,Young v. Johnson,(none),Per Curiam
18375,2001 ND 105,State v. Schwartz,(none),Per Curiam
13370,2001 ND 86,Disciplinary Board v. Howe,(none),Per Curiam
18397,2001 ND 25,Interest of J.S. (CONFIDENTIAL-M.H.),(none),Per Curiam
13303,2001 ND 10,Interest of J.S. (CONFIDENTIAL-M.H.),Sandstrom,Per Curiam
18404,2001 ND 50,Dvorak v. State,(none),Per Curiam
18385,2001 ND 160,Stockert v. Stockert,(none),Per Curiam
18408,2001 ND 76,State v. McHugh,(none),Per Curiam
13289,2001 ND 1,Petition for Change of Designation of Judgeship No. 1,(none),Per Curiam
18378,2001 ND 108,Demming v. Demming,(none),Per Curiam
18380,2001 ND 117,State v. Jensen                  (Consolidated w/20010013 & 20010014),(none),Per Curiam
18381,2001 ND 119,Tweit v. Erickson,(none),Per Curiam
13527,2001 ND 172,"Farmers Elevator, Inc. of Grace City v. Custom Processors, Inc.",(none),Per Curiam
18382,2001 ND 128,"Matrix v. TAG Investments       (Cross-ref. w/990336, 20000192 & 20000356)",(none),Per Curiam
13346,2001 ND 63,Disciplinary Board v. Keller,(none),Per Curiam
18387,2001 ND 162,Davison v. Wanner,(none),Per Curiam
13493,2001 ND 210,Disciplinary Board v. Boulger,(none),Per Curiam
18388,2001 ND 164,State v. Gleeson,(none),Per Curiam
18384,2001 ND 159,"State v. Jensen                         (Cross-Ref. w/20010012, 13 & 14)",(none),Per Curiam
18438,2002 ND 41,State v. Morrison,(none),Per Curiam
18432,2002 ND 19,State v. Guy,(none),Per Curiam
18389,2001 ND 171,Bell v. State,(none),Per Curiam
18437,2002 ND 40,State v. Aipperspach,(none),Per Curiam
18392,2001 ND 196,State v. Gates                                       (Cross-ref. w/940388),(none),Per Curiam
18428,2002 ND 18,Burke v. State,(none),Per Curiam
18391,2001 ND 181,Hellerud v. ND Dept. of Transportation,(none),Per Curiam
18390,2001 ND 179,"Alerus Financial v. Lamb, et al.             (CONSOLIDATED W/20010178)",(none),Per Curiam
13423,2001 ND 134,Name Change of State Bar Board to Board of Law Examiners,(none),Per Curiam
13444,2001 ND 158,Disciplinary Board v. Gronneberg,(none),Per Curiam
18436,2002 ND 3,State v. Marshall    (Consolidated w/20010253),(none),Per Curiam
18415,2002 ND 11,State v. BlackCloud,(none),Per Curiam
13497,2002 ND 9,Disciplinary Board v. Crary,(none),Per Curiam
